{
  "schema_id": "https://gsd.local/schemas/runtime-evidence/m016-s05-seven-division-replay-bundle.v1.json",
  "schema_version": "v1",
  "bundle_id": "m016-s05-seven-division-replay-bundle-v1",
  "bundle_kind": "seven-division-evidence-replay-bundle",
  "milestone": "M016-txa3vu",
  "slice": "S05",
  "task": "T02",
  "generated": "2026-07-20T12:00:00.000Z",
  "bundle_digest": "ceb03b5f5115e8586cac685b4e5ed089caf5cb099558ffa33182dc499c2dcd36",
  "evidence_chain": [
    {
      "source_ref": "runtime-evidence/M016-S02-bos-mission-proof.json",
      "kind": "s02_baseline",
      "chain_role": "s02_baseline",
      "independence_group": "m016-s02-bos-mission-proof",
      "pre_hash_sha256": "373d54e024ee847dc0388a4e2acfbdba536d1eef8392bd89ce929a618050e329",
      "post_hash_sha256": "373d54e024ee847dc0388a4e2acfbdba536d1eef8392bd89ce929a618050e329",
      "unchanged": true,
      "scope": "offline-readonly-source-hash-window",
      "limitations": [
        "hashes only; raw source bodies are not persisted",
        "no live or network mutation"
      ]
    },
    {
      "source_ref": "runtime-evidence/M016-S03-safe-operational-evidence-pack.json",
      "kind": "s03_pack",
      "chain_role": "s03_pack",
      "independence_group": "m016-s03-pack",
      "pre_hash_sha256": "e8550b4c3dd015085de375278bb637f8cc3aff492bd8841265103551672bac14",
      "post_hash_sha256": "e8550b4c3dd015085de375278bb637f8cc3aff492bd8841265103551672bac14",
      "unchanged": true,
      "scope": "offline-readonly-source-hash-window",
      "limitations": [
        "hashes only; raw source bodies are not persisted",
        "no live or network mutation"
      ]
    },
    {
      "source_ref": "runtime-evidence/M016-S04-div4-div5-canary-bundle.json",
      "kind": "s04_canary_bundle",
      "chain_role": "s04_canary_bundle",
      "independence_group": "m016-s04-canary-bundle",
      "pre_hash_sha256": "3f0dd1b187ccb66f80b6e1332809686bbcc3f73a7eb9d3a13274faf30ab883cd",
      "post_hash_sha256": "3f0dd1b187ccb66f80b6e1332809686bbcc3f73a7eb9d3a13274faf30ab883cd",
      "unchanged": true,
      "scope": "offline-readonly-source-hash-window",
      "limitations": [
        "hashes only; raw source bodies are not persisted",
        "no live or network mutation"
      ]
    },
    {
      "source_ref": "runtime-evidence/M016-S05-seven-division-replay-probe-run.json",
      "kind": "replay_probe_run",
      "chain_role": "replay_probe_run",
      "independence_group": "m016-s05-replay-probe-run",
      "pre_hash_sha256": "9e19bebf23e2cf25dbe61d11bebf5dfcc87a5e965c9808566a9909972528cbc0",
      "post_hash_sha256": "9e19bebf23e2cf25dbe61d11bebf5dfcc87a5e965c9808566a9909972528cbc0",
      "unchanged": true,
      "scope": "offline-readonly-source-hash-window",
      "limitations": [
        "hashes only; raw source bodies are not persisted",
        "no live or network mutation"
      ]
    }
  ],
  "correlation_contract": {
    "agent_run_id": "M16-S05-REPLAY-RUN-integration-replay",
    "probe_to_criterion": [
      {
        "probe_id": "M16-S03-PROBE-div1-hco-no-target-400ce295",
        "agent_run_id": "M16-S05-REPLAY-RUN-integration-replay",
        "evidence_id": "m016-s05-replay-evidence-div1-hco-no-target-400ce295",
        "criterion_id": "HG1 SEMANTIC_RULE_COMPLIANCE",
        "classification": "NOT_PROVEN",
        "independence_group": "m016-s03-probe-div1-hco",
        "independence_key": "live_replay_record:m016-s03-probe-div1-hco",
        "weight": 0
      },
      {
        "probe_id": "M16-S03-PROBE-div2-masterplanner-no-target-5deb9249",
        "agent_run_id": "M16-S05-REPLAY-RUN-integration-replay",
        "evidence_id": "m016-s05-replay-evidence-div2-masterplanner-no-target-5deb9249",
        "criterion_id": "HG1 SEMANTIC_RULE_COMPLIANCE",
        "classification": "NOT_PROVEN",
        "independence_group": "m016-s03-probe-div2-master-planner",
        "independence_key": "live_replay_record:m016-s03-probe-div2-master-planner",
        "weight": 0
      },
      {
        "probe_id": "M16-S03-PROBE-div3-treasury-no-target-2bd09913",
        "agent_run_id": "M16-S05-REPLAY-RUN-integration-replay",
        "evidence_id": "m016-s05-replay-evidence-div3-treasury-no-target-2bd09913",
        "criterion_id": "HG1 SEMANTIC_RULE_COMPLIANCE",
        "classification": "NOT_PROVEN",
        "independence_group": "m016-s03-probe-div3-treasury",
        "independence_key": "live_replay_record:m016-s03-probe-div3-treasury",
        "weight": 0
      },
      {
        "probe_id": "M16-S03-PROBE-div4-production-no-target-4516d67f",
        "agent_run_id": "M16-S05-REPLAY-RUN-integration-replay",
        "evidence_id": "m016-s05-replay-evidence-div4-production-no-target-4516d67f",
        "criterion_id": "HG1 SEMANTIC_RULE_COMPLIANCE",
        "classification": "NOT_PROVEN",
        "independence_group": "m016-s03-probe-div4-production",
        "independence_key": "live_replay_record:m016-s03-probe-div4-production",
        "weight": 0
      },
      {
        "probe_id": "M16-S03-PROBE-div5-qualificationslibrarylearning-no-target-7a0381eb",
        "agent_run_id": "M16-S05-REPLAY-RUN-integration-replay",
        "evidence_id": "m016-s05-replay-evidence-div5-qualificationslibrarylearning-no-target-7a0",
        "criterion_id": "HG1 SEMANTIC_RULE_COMPLIANCE",
        "classification": "NOT_PROVEN",
        "independence_group": "m016-s03-probe-div5-qualifications",
        "independence_key": "live_replay_record:m016-s03-probe-div5-qualifications",
        "weight": 0
      },
      {
        "probe_id": "M16-S03-PROBE-div6-external-no-target-4537f75b",
        "agent_run_id": "M16-S05-REPLAY-RUN-integration-replay",
        "evidence_id": "m016-s05-replay-evidence-div6-external-no-target-4537f75b",
        "criterion_id": "HG1 SEMANTIC_RULE_COMPLIANCE",
        "classification": "NOT_PROVEN",
        "independence_group": "m016-s03-probe-div6-external",
        "independence_key": "live_replay_record:m016-s03-probe-div6-external",
        "weight": 0
      },
      {
        "probe_id": "M16-S03-PROBE-div7-missioncontrol-no-target-421b3417",
        "agent_run_id": "M16-S05-REPLAY-RUN-integration-replay",
        "evidence_id": "m016-s05-replay-evidence-div7-missioncontrol-no-target-421b3417",
        "criterion_id": "HG1 SEMANTIC_RULE_COMPLIANCE",
        "classification": "NOT_PROVEN",
        "independence_group": "m016-s03-probe-div7-mission-control",
        "independence_key": "live_replay_record:m016-s03-probe-div7-mission-control",
        "weight": 0
      },
      {
        "probe_id": "M16-S03-PROBE-paperclip_health-no-target-962e3e75",
        "agent_run_id": "M16-S05-REPLAY-RUN-integration-replay",
        "evidence_id": "m016-s05-replay-evidence-paperclip_health-no-target-962e3e75",
        "criterion_id": "HG7 READ_ONLY_BOUNDARY",
        "classification": "NOT_PROVEN",
        "independence_group": "m016-s03-probe-paperclip-health",
        "independence_key": "live_replay_record:m016-s03-probe-paperclip-health",
        "weight": 0
      },
      {
        "probe_id": "M16-S03-PROBE-hermes_environment-no-target-b972fa5d",
        "agent_run_id": "M16-S05-REPLAY-RUN-integration-replay",
        "evidence_id": "m016-s05-replay-evidence-hermes_environment-no-target-b972fa5d",
        "criterion_id": "HG5 SECURITY_POSTURE",
        "classification": "NOT_PROVEN",
        "independence_group": "m016-s03-probe-hermes-environment",
        "independence_key": "live_replay_record:m016-s03-probe-hermes-environment",
        "weight": 0
      },
      {
        "probe_id": "M16-S03-PROBE-secret_posture-probe-ea022dda",
        "agent_run_id": "M16-S05-REPLAY-RUN-integration-replay",
        "evidence_id": "m016-s05-replay-evidence-secret_posture-probe-ea022dda",
        "criterion_id": "HG5 SECURITY_POSTURE",
        "classification": "EXECUTED",
        "independence_group": "m016-s03-probe-secret-posture",
        "independence_key": "live_replay_record:m016-s03-probe-secret-posture",
        "weight": 1
      },
      {
        "probe_id": "M16-S03-PROBE-cost_snapshot-probe-7cf5323f",
        "agent_run_id": "M16-S05-REPLAY-RUN-integration-replay",
        "evidence_id": "m016-s05-replay-evidence-cost_snapshot-probe-7cf5323f",
        "criterion_id": "HG4 FINANCIAL_PROTECTION",
        "classification": "EXECUTED",
        "independence_group": "m016-s03-probe-cost-snapshot",
        "independence_key": "live_replay_record:m016-s03-probe-cost-snapshot",
        "weight": 1
      },
      {
        "probe_id": "M16-S03-PROBE-isolation_invariant-probe-be2ad5b9",
        "agent_run_id": "M16-S05-REPLAY-RUN-integration-replay",
        "evidence_id": "m016-s05-replay-evidence-isolation_invariant-probe-be2ad5b9",
        "criterion_id": "HG7 READ_ONLY_BOUNDARY",
        "classification": "EXECUTED",
        "independence_group": "m016-s03-probe-isolation-invariant",
        "independence_key": "live_replay_record:m016-s03-probe-isolation-invariant",
        "weight": 1
      },
      {
        "probe_id": "M16-S03-PROBE-restore_drill-no-target-c1adca5f",
        "agent_run_id": "M16-S05-REPLAY-RUN-integration-replay",
        "evidence_id": "m016-s05-replay-evidence-restore_drill-no-target-c1adca5f",
        "criterion_id": "HG3 RECOVERY_EVIDENCE",
        "classification": "NOT_PROVEN",
        "independence_group": "m016-s03-probe-restore-drill",
        "independence_key": "live_replay_record:m016-s03-probe-restore-drill",
        "weight": 0
      },
      {
        "probe_id": "M16-S03-PROBE-budget_stop_drill-no-target-8279328b",
        "agent_run_id": "M16-S05-REPLAY-RUN-integration-replay",
        "evidence_id": "m016-s05-replay-evidence-budget_stop_drill-no-target-8279328b",
        "criterion_id": "HG4 FINANCIAL_PROTECTION",
        "classification": "NOT_PROVEN",
        "independence_group": "m016-s03-probe-budget-stop-drill",
        "independence_key": "live_replay_record:m016-s03-probe-budget-stop-drill",